{
  "schemaVersion": 1,
  "id": "smrttech-3cc3",
  "code": "SMRTTECH 3CC3",
  "title": "Cloud Computing and the Internet of Things",
  "term": "Fall 2026",
  "institution": "McMaster University",
  "school": "W Booth School of Engineering Practice and Technology",
  "program": "Automation Engineering Technology",
  "portal": {
    "headline": "Unified *Lab Learning Space*",
    "lead": [
      "A CloudLab-styled course portal where interactive laboratory manuals and the shared knowledge database live together, so students can move from a task to the supporting concept without leaving the course environment."
    ],
    "chips": [
      "Automation Engineering Technology",
      "Single student entry point",
      "Shared knowledge database",
      "Reusable lab architecture",
      "Static-site friendly"
    ],
    "about": {
      "title": "Labs and knowledge live in the same student space",
      "cards": [
        {
          "eyebrow": "Entry",
          "title": "Course Hub",
          "body": "Start page, lab catalog, architecture overview, and student orientation."
        },
        {
          "eyebrow": "Work",
          "title": "Lab Manuals",
          "body": "Interactive stages, measurements, checks, and evidence capture."
        },
        {
          "eyebrow": "Support",
          "title": "Knowledge DB",
          "body": "Short reusable articles for concepts, tools, code, and troubleshooting."
        },
        {
          "eyebrow": "Foundation",
          "title": "Shared Assets",
          "body": "McMaster styling, diagrams, lab figures, and course-owned media."
        },
        {
          "eyebrow": "Scale",
          "title": "Future Labs",
          "body": "New labs plug into the same shell, reference model, and visual system."
        },
        {
          "eyebrow": "Information Model",
          "title": "Labs",
          "body": "Procedures, stages, tables, quizzes, and checklists."
        },
        {
          "eyebrow": "Information Model",
          "title": "Topics",
          "body": "Reusable explanations independent of a single lab."
        },
        {
          "eyebrow": "Information Model",
          "title": "Evidence",
          "body": "Local student entries, measurements, predictions, and reflections."
        }
      ],
      "flow": [
        "Open course hub",
        "Choose lab",
        "Use just-in-time knowledge",
        "Record evidence",
        "Demonstrate or submit"
      ]
    }
  },
  "knowledge": {
    "eyebrow": "McMaster University · SMRTTECH 3CC3",
    "title": "Knowledge Database",
    "description": "Reusable student support organized by concept family: LabVIEW, circuits, measurement, Arduino, simulation, and engineering practice. Every topic offers a short explanation, a practical check, and a relevant lab connection, so students can search or filter concepts and return straight to the lab workflow."
  },
  "footer": "McMaster University | SMRTTECH 3CC3 · W Booth School of Engineering Practice and Technology",
  "designSystemVersion": "1.0.0"
}
